{
  "schema": "rule-v1",
  "id": "evidence.control_absence",
  "name": "control_no_outgrowth",
  "version": 1,
  "status": "active",
  "purpose": "interpretation",
  "evaluator": "evidence.assess_observations",
  "parameters": {
    "claim": "control_no_outgrowth",
    "context": "observation",
    "truth_table": [
      {
        "when": [
          {
            "field": "count_known",
            "op": "eq",
            "value": false
          }
        ],
        "status": "NOT_TESTED",
        "reason": "The reported negative-control count is missing; missing is not zero.",
        "source_ref": "evidence.control_absence"
      },
      {
        "when": [
          {
            "field": "count_known",
            "op": "eq",
            "value": true
          },
          {
            "field": "count_positive",
            "op": "eq",
            "value": false
          }
        ],
        "status": "SUPPORTED",
        "reason": "Zero colonies were reported for this control; this is not proof of cell death.",
        "source_ref": "evidence.control_absence"
      },
      {
        "when": [
          {
            "field": "count_known",
            "op": "eq",
            "value": true
          },
          {
            "field": "count_positive",
            "op": "eq",
            "value": true
          }
        ],
        "status": "CONTRADICTED",
        "reason": "Colonies were reported in the designated no-outgrowth control; reported absence is contradicted.",
        "source_ref": "evidence.control_absence"
      }
    ]
  },
  "applies_when": [
    {
      "field": "role",
      "op": "eq",
      "value": "inactivated_donor_control"
    }
  ],
  "source": {
    "source_class": "project_contract",
    "citation": "Genome Revival Toolkit SPEC D12 and Appendix B3 (2026-10-16)",
    "locator": "prompts/s3-revival-evidence.md Sources and negative cases; spec/SPEC.md B3",
    "retrieved_at": "2026-10-16",
    "content_ref": null,
    "archive_note": "Project files retained in repository history.",
    "supports": [
      "Preserve the requested contradiction for an inactivated-donor no-outgrowth control and missing-count handling."
    ],
    "does_not_support": [
      "Biological proof of revival, elimination, causality or record authenticity."
    ],
    "verification_status": "unverified"
  },
  "limits": [
    "Project interpretation boundary; not an experimentally established biological sufficiency rule."
  ],
  "review": "knowledge/review/control_absence.review.json",
  "authorship": {
    "kind": "ai",
    "tool_or_model": "Codex",
    "date": "2026-10-16"
  }
}
