{"applies_when":[{"field":"role","op":"eq","value":"inactivated_donor_control"}],"authorship":{"date":"2026-10-16","kind":"ai","tool_or_model":"Codex"},"evaluator":"evidence.assess_observations","id":"evidence.control_absence","limits":["Project interpretation boundary; not an experimentally established biological sufficiency rule."],"name":"control_no_outgrowth","parameters":{"claim":"control_no_outgrowth","context":"observation","truth_table":[{"reason":"The reported negative-control count is missing; missing is not zero.","source_ref":"evidence.control_absence","status":"NOT_TESTED","when":[{"field":"count_known","op":"eq","value":false}]},{"reason":"Zero colonies were reported for this control; this is not proof of cell death.","source_ref":"evidence.control_absence","status":"SUPPORTED","when":[{"field":"count_known","op":"eq","value":true},{"field":"count_positive","op":"eq","value":false}]},{"reason":"Colonies were reported in the designated no-outgrowth control; reported absence is contradicted.","source_ref":"evidence.control_absence","status":"CONTRADICTED","when":[{"field":"count_known","op":"eq","value":true},{"field":"count_positive","op":"eq","value":true}]}]},"purpose":"interpretation","review":"knowledge/review/control_absence.review.json","schema":"rule-v1","source":{"archive_note":"Project files retained in repository history.","citation":"Genome Revival Toolkit SPEC D12 and Appendix B3 (2026-10-16)","content_ref":null,"does_not_support":["Biological proof of revival, elimination, causality or record authenticity."],"locator":"prompts/s3-revival-evidence.md Sources and negative cases; spec/SPEC.md B3","retrieved_at":"2026-10-16","source_class":"project_contract","supports":["Preserve the requested contradiction for an inactivated-donor no-outgrowth control and missing-count handling."],"verification_status":"unverified"},"status":"active","version":1}