{"applies_when":[],"authorship":{"date":"2026-10-16","kind":"ai","tool_or_model":"Codex"},"evaluator":"evidence.assess_observations","id":"evidence.functional_revival","limits":["Project interpretation boundary; not an experimentally established biological sufficiency rule."],"name":"functional_revival","parameters":{"claim":"functional_revival","context":"summary","truth_table":[{"reason":"No counts, genotype assays or functional observations were supplied.","source_ref":"evidence.functional_revival","status":"NOT_TESTED","when":[{"field":"any_tested","op":"eq","value":false}]},{"reason":"Reported colony growth and selected assays do not establish donor-dependent functional revival.","source_ref":"evidence.functional_revival","status":"INSUFFICIENT","when":[{"field":"any_tested","op":"eq","value":true}]}]},"purpose":"interpretation","review":"knowledge/review/functional_revival.review.json","schema":"rule-v1","source":{"archive_note":"Project files retained in repository history.","citation":"Genome Revival Toolkit SPEC D12 and Appendix B3 (2026-10-16)","content_ref":null,"does_not_support":["Biological proof of revival, elimination, causality or record authenticity."],"locator":"spec/SPEC.md D12; B3; prompts/s3-revival-evidence.md","retrieved_at":"2026-10-16","source_class":"project_contract","supports":["Adopt a bounded conclusion; observations alone cannot certify functional revival."],"verification_status":"unverified"},"status":"active","version":1}