{"applies_when":[],"authorship":{"date":"2026-10-17","kind":"ai","tool_or_model":"Codex"},"evaluator":"evidence.assess_observations","id":"evidence.local_prediction","limits":["Project interpretation boundary; not an experimentally established biological sufficiency rule."],"name":"local_prediction_agreement","parameters":{"claim":"local_prediction_agreement","context":"assay","truth_table":[{"reason":"No observation was supplied for this local predicted assay.","source_ref":"evidence.local_prediction","status":"NOT_TESTED","when":[{"field":"tested","op":"eq","value":false}]},{"reason":"Incomplete genotype record: a positive result requires observed_band_bp; this observation cannot be used as a complete local result.","source_ref":"evidence.local_prediction","status":"INSUFFICIENT","when":[{"field":"tested","op":"eq","value":true},{"field":"size_known","op":"eq","value":false}]},{"reason":"An interpretable prediction bound to the reported reference hash is missing.","source_ref":"evidence.local_prediction","status":"INSUFFICIENT","when":[{"field":"tested","op":"eq","value":true},{"field":"covered","op":"eq","value":false},{"field":"size_known","op":"eq","value":true}]},{"reason":"Passing assay controls were not reported.","source_ref":"evidence.local_prediction","status":"INSUFFICIENT","when":[{"field":"tested","op":"eq","value":true},{"field":"covered","op":"eq","value":true},{"field":"controls_passed","op":"eq","value":false},{"field":"size_known","op":"eq","value":true},{"field":"determinate","op":"eq","value":false}]},{"reason":"Passing assay controls were not reported.","source_ref":"evidence.local_prediction","status":"INSUFFICIENT","when":[{"field":"tested","op":"eq","value":true},{"field":"covered","op":"eq","value":true},{"field":"controls_passed","op":"eq","value":false},{"field":"size_known","op":"eq","value":true},{"field":"determinate","op":"eq","value":true},{"field":"agrees","op":"eq","value":true}]},{"reason":"The reported assay result is indeterminate.","source_ref":"evidence.local_prediction","status":"INSUFFICIENT","when":[{"field":"tested","op":"eq","value":true},{"field":"covered","op":"eq","value":true},{"field":"controls_passed","op":"eq","value":true},{"field":"determinate","op":"eq","value":false},{"field":"size_known","op":"eq","value":true}]},{"reason":"Reported local result agrees with the supplied prediction within the explicitly reported size tolerance.","source_ref":"evidence.local_prediction","status":"SUPPORTED","when":[{"field":"tested","op":"eq","value":true},{"field":"covered","op":"eq","value":true},{"field":"controls_passed","op":"eq","value":true},{"field":"determinate","op":"eq","value":true},{"field":"size_known","op":"eq","value":true},{"field":"agrees","op":"eq","value":true}]},{"reason":"A complete reported positive band contradicts the supplied local prediction: unexpected presence or size outside the declared tolerance.","source_ref":"evidence.local_prediction","status":"CONTRADICTED","when":[{"field":"tested","op":"eq","value":true},{"field":"covered","op":"eq","value":true},{"field":"determinate","op":"eq","value":true},{"field":"size_known","op":"eq","value":true},{"field":"agrees","op":"eq","value":false},{"field":"result","op":"eq","value":"positive"}]},{"reason":"A negative result without reported passed controls cannot distinguish reaction failure from a mismatch with the prediction.","source_ref":"evidence.local_prediction","status":"INSUFFICIENT","when":[{"field":"tested","op":"eq","value":true},{"field":"covered","op":"eq","value":true},{"field":"determinate","op":"eq","value":true},{"field":"size_known","op":"eq","value":true},{"field":"agrees","op":"eq","value":false},{"field":"result","op":"eq","value":"negative"},{"field":"controls_passed","op":"eq","value":false}]},{"reason":"Passing controls were reported, so the reported absence of a band contradicts the supplied local band prediction; this does not authenticate the experiment.","source_ref":"evidence.local_prediction","status":"CONTRADICTED","when":[{"field":"tested","op":"eq","value":true},{"field":"covered","op":"eq","value":true},{"field":"determinate","op":"eq","value":true},{"field":"size_known","op":"eq","value":true},{"field":"agrees","op":"eq","value":false},{"field":"result","op":"eq","value":"negative"},{"field":"controls_passed","op":"eq","value":true}]}]},"purpose":"interpretation","review":"knowledge/review/local_prediction.review.json","schema":"rule-v1","source":{"archive_note":"Project files retained in repository history.","citation":"Genome Revival Toolkit SPEC D12 and Appendix B3 (2026-10-16); user decision 2026-10-17","content_ref":null,"does_not_support":["Biological proof of revival, elimination, causality or record authenticity."],"locator":"spec/SPEC.md B3 boundary; prompts/s5b-genome-identity.md output handoff; prompts/s3-revival-evidence.md goal; prompts/s1d-usability-fixes.md B4; prompts/s1d-usability-fixes.md B5; prompts/s1e-evidence-rule-and-docs.md section 1","retrieved_at":"2026-10-17","source_class":"project_contract","supports":["Compare supplied, hash-bound local predictions with reported results; support or contradict only that local agreement.","A complete reported positive band may contradict a local prediction without confirmed passing controls; a negative mismatch requires reported passed controls. User decision 2026-10-17; project interpretation only."],"verification_status":"unverified"},"status":"active","version":1}